title,url,publishedAt,description,source,text,sentiment_score,sentiment_label
McDonald’s just had its worst quarter since Covid. It said customers are getting nervous,https://edition.cnn.com/2025/05/01/investing/mcdonalds-earnings-first-quarter-2025,2025-05-01 19:17:42,,Reddit,McDonald’s just had its worst quarter since Covid. It said customers are getting nervous. ,-0.7351,negative
"Trump authorizes 100% tariff on foreign films, citing national security and Hollywood decline",https://i.redd.it/k80lxj9ppuye1.png,2025-05-04 23:40:39,Source: [https://truthsocial.com/@realDonaldTrump/114452117143235155](https://truthsocial.com/@realDonaldTrump/114452117143235155),Reddit,"Trump authorizes 100% tariff on foreign films, citing national security and Hollywood decline. Source: [https://truthsocial.com/@realDonaldTrump/114452117143235155](https://truthsocial.com/@realDonaldTrump/114452117143235155)",0.34,positive
i am the wolf of wallstreet 😎,https://i.redd.it/bj9e85itfsye1.jpeg,2025-05-04 16:00:37,,Reddit,i am the wolf of wallstreet 😎. ,0.0,neutral
Tarrifs are GOoD,https://i.redd.it/o5239z8jozxe1.jpeg,2025-04-30 15:17:48,,Reddit,Tarrifs are GOoD. ,0.4404,positive
"The clock is ticking down to zero, and Trump needs a trade deal — badly",https://amp.cnn.com/cnn/2025/05/05/business/trade-war-deal-trump,2025-05-05 14:42:48,,Reddit,"The clock is ticking down to zero, and Trump needs a trade deal — badly. ",-0.4767,negative
Recession coming? Some anecdotal signs...,https://www.reddit.com/r/StockMarket/comments/1kfnmob/recession_coming_some_anecdotal_signs/,2025-05-05 21:32:48,"Is a recession on the horizon? Some anecdotal signs worth noting:

- My mother-in-law runs a leather repair shop focused on high-end items like shoes and wallets. Historically, her business thrives during economic downturns as people choose to repair instead of replace. Right now, her shop has a high demand.

- I work in the construction industry, which tends to feel the effects of a downturn early. Lately, we've noticed a slowdown in project volume: cancelled projects, fewer new builds, and delayed starts.

- Two family members were recently laid off, both in different sectors. Three are force retired.

None of this is definitive, but it’s hard to ignore the pattern. ",Reddit,"Recession coming? Some anecdotal signs.... Is a recession on the horizon? Some anecdotal signs worth noting:

- My mother-in-law runs a leather repair shop focused on high-end items like shoes and wallets. Historically, her business thrives during economic downturns as people choose to repair instead of replace. Right now, her shop has a high demand.

- I work in the construction industry, which tends to feel the effects of a downturn early. Lately, we've noticed a slowdown in project volume: cancelled projects, fewer new builds, and delayed starts.

- Two family members were recently laid off, both in different sectors. Three are force retired.

None of this is definitive, but it’s hard to ignore the pattern. ",-0.7359,negative
Real GDP falls to -.3% from 2.4%,https://www.bea.gov/news/2025/gross-domestic-product-1st-quarter-2025-advance-estimate,2025-04-30 12:36:26,,Reddit,Real GDP falls to -.3% from 2.4%. ,0.0,neutral
Trump says he'll blame Biden again for 2nd quarter GDP after blaming him for Q1 drop,https://www.cnbc.com/2025/04/30/trump-gdp-tariffs-biden-overhang.html,2025-05-01 00:06:57,,Reddit,Trump says he'll blame Biden again for 2nd quarter GDP after blaming him for Q1 drop. ,-0.7717,negative
Buffett: This year's stock market turmoil 'is really nothing',https://finance.yahoo.com/news/buffett-this-years-stock-market-turmoil-is-really-nothing-153111329.html,2025-05-03 15:54:36,"For Warren Buffett, this year's volatility has been nothing to write home about.

""What has happened in the last 30, 45 days, 100 days, whenever you want to pick, whatever this period has been, is really nothing,"" Buffett said at the Berkshire Hathaway annual meeting on Saturday. ""This has not been a dramatic bear market or anything [of] the sort.""

[…]

And if the world changing is something that makes you change what your goals are as an investor, Buffett added, then it's time to get a new slant.

""If it makes a difference to you whether your stocks are down 15% or not, you need to get a somewhat different investment philosophy,"" the Oracle of Omaha said. ""The world is not going to adapt to you. You're going to have to adapt to the world.""

[…]

Complete article: https://finance.yahoo.com/news/buffett-this-years-stock-market-turmoil-is-really-nothing-153111329.html
",Reddit,"Buffett: This year's stock market turmoil 'is really nothing'. For Warren Buffett, this year's volatility has been nothing to write home about.

""What has happened in the last 30, 45 days, 100 days, whenever you want to pick, whatever this period has been, is really nothing,"" Buffett said at the Berkshire Hathaway annual meeting on Saturday. ""This has not been a dramatic bear market or anything [of] the sort.""

[…]

And if the world changing is something that makes you change what your goals are as an investor, Buffett added, then it's time to get a new slant.

""If it makes a difference to you whether your stocks are down 15% or not, you need to get a somewhat different investment philosophy,"" the Oracle of Omaha said. ""The world is not going to adapt to you. You're going to have to adapt to the world.""

[…]

Complete article: https://finance.yahoo.com/news/buffett-this-years-stock-market-turmoil-is-really-nothing-153111329.html
",-0.296,negative
Is the US Headed for a Recession?,https://www.morningstar.co.uk/uk/news/264270/is-the-us-headed-for-a-recession.aspx,2025-05-02 12:09:22,,Reddit,Is the US Headed for a Recession?. ,0.0,neutral
Top Trump economist derided as ‘incoherent’ on tariffs after closed-door meeting with bond investors,https://finance.yahoo.com/news/top-trump-economist-derided-incoherent-110700105.html,2025-05-01 23:58:56,"When you’re faced with actual professionals, ur cultist talking points won’t work anymore. 

It’s like a snake oil salesman trying to sell snake oil to a room of doctors. Bond investors know exactly what the situation is, numbers are numbers, there’s no finessing or magic tricks that can be done.",Reddit,"Top Trump economist derided as ‘incoherent’ on tariffs after closed-door meeting with bond investors. When you’re faced with actual professionals, ur cultist talking points won’t work anymore. 

It’s like a snake oil salesman trying to sell snake oil to a room of doctors. Bond investors know exactly what the situation is, numbers are numbers, there’s no finessing or magic tricks that can be done.",-0.0516,negative
The Fed just bought $34.8B in Treasuries in 2 days — but it’s “not QE”… right?,https://i.redd.it/xw7zawy1w7ze1.jpeg,2025-05-06 19:58:22,"Not calling it full-blown QE, but $34.8B in just two days does raise questions. If this kind of liquidity is being pushed into bonds, it’s hard to believe equities won’t feel the ripple.
Markets have been unusually resilient despite weak fundamentals—maybe this is part of the reason why. Feels like something bigger is quietly in motion.
What do you think guys? What effects could this have on the stock market? Any guesses? ",Reddit,"The Fed just bought $34.8B in Treasuries in 2 days — but it’s “not QE”… right?. Not calling it full-blown QE, but $34.8B in just two days does raise questions. If this kind of liquidity is being pushed into bonds, it’s hard to believe equities won’t feel the ripple.
Markets have been unusually resilient despite weak fundamentals—maybe this is part of the reason why. Feels like something bigger is quietly in motion.
What do you think guys? What effects could this have on the stock market? Any guesses? ",0.8208,positive
Warrent Buffet ladies and gentlemen,https://i.redd.it/gje3qwqmzpye1.jpeg,2025-05-04 07:46:20,,Reddit,Warrent Buffet ladies and gentlemen. ,0.0,neutral
WTF just happened to SPY at 3:30pm EST?,https://i.redd.it/i6udl99o21ye1.png,2025-04-30 19:59:43,7 points in 20 minutes at the very end of the day?!,Reddit,WTF just happened to SPY at 3:30pm EST?. 7 points in 20 minutes at the very end of the day?!,-0.7339,negative
Don’t Look at Stock Markets. Look at the Ports.,https://www.theatlantic.com/economy/archive/2025/05/trump-tariff-shipping-ports/682673/,2025-05-03 19:10:43,,Reddit,Don’t Look at Stock Markets. Look at the Ports.. ,0.0,neutral
"Disney, Netflix Stocks Fall After Trump Threatens 100% Movie Tariff",https://variety.com/2025/film/news/trump-movie-tariff-stocks-studios-disney-netflix-1236386712/#recipient_hashed=4b93ba2bac821d2ff0b26ea351f78f70954c9887ea364450876938a9120e7574&recipient_salt=f96d93bc1bb60a7404e4f81e2b5317444a380cc49a0dd28a68c6b9b5649b7248&utm_medium=email&utm_source=exacttarget&utm_campaign=newsalert&utm_content=604510_05-05-2025&utm_term=382704,2025-05-05 13:43:17,"That was fast.

>At the open of the U.S. stock market regular trading Monday, Netflix’s stock was down -3.3%, Disney was -2.4%, WBD was -4.2% and Paramount was -2.2%. The declines were steeper than in broader market indexes like the S&P 500 (-0.70%) and the Nasdaq Composite (-0.82%).",Reddit,"Disney, Netflix Stocks Fall After Trump Threatens 100% Movie Tariff. That was fast.

>At the open of the U.S. stock market regular trading Monday, Netflix’s stock was down -3.3%, Disney was -2.4%, WBD was -4.2% and Paramount was -2.2%. The declines were steeper than in broader market indexes like the S&P 500 (-0.70%) and the Nasdaq Composite (-0.82%).",-0.0258,neutral
So long china deal…,https://abcnews.go.com/International/wireStory/trump-threatens-sanctions-buyers-iranian-oil-after-us-121358617,2025-05-02 01:13:31,"Trump wrote on social media, “All purchases of Iranian Oil, or Petrochemical products, must stop, NOW!” He said any country or person who buys those products from Iran will not be able to do business with the United States “in any way, shape, or form.”

Guess which country buys the most oil from Iran? China — it purchases nearly 90% of Iran’s oil exports. Interesting times ahead.

",Reddit,"So long china deal…. Trump wrote on social media, “All purchases of Iranian Oil, or Petrochemical products, must stop, NOW!” He said any country or person who buys those products from Iran will not be able to do business with the United States “in any way, shape, or form.”

Guess which country buys the most oil from Iran? China — it purchases nearly 90% of Iran’s oil exports. Interesting times ahead.

",0.5562,positive
"It’s still amazing that Buffett’s crowning achievement was simply buying Apple in 2016, when Apple was already the largest company in the world by market cap ($600bn at the time)… and just adding and holding on to it.",https://x.com/mkt_sentiment/status/1918934404153455030,2025-05-05 06:49:23,,Reddit,"It’s still amazing that Buffett’s crowning achievement was simply buying Apple in 2016, when Apple was already the largest company in the world by market cap ($600bn at the time)… and just adding and holding on to it.. ",0.5859,positive
"US Has Reached Out to China to Initiate Tariff Talks, CCTV Says",https://www.reddit.com/r/StockMarket/comments/1kbwoj8/us_has_reached_out_to_china_to_initiate_tariff/,2025-05-01 01:11:51,"(Bloomberg) — US President Donald Trump’s administration has been seeking contact with Beijing to initiate talks on the massive tariffs Washington has imposed on China, according to a state-run media outlet.

The US government recently reached out to China though various channels, Yuyuantantian, a Weibo account affiliated with China Central Television that regularly signals Beijing’s views on trade, said in a post. It cited unidentified people with knowledge of the matter, providing no further details.

The post casts a different light on behind-the-scenes maneuvering between the world’s two largest economies. Trump has repeatedly said President Xi Jinping needs to contact him in order to begin tariff talks and earlier this week, Treasury Secretary Scott Bessent said it’s up to Beijing to take the first step to de-escalate the dispute.

Trump argued Wednesday during a Cabinet meeting that a recent fall in cargo flows indicated that Beijing would soon need to engage with him. The president said he was “not happy” with the sharp decline in trade between the two nations because he wanted “China to do well” while treating the US fairly.

Trump later Wednesday expressed confidence he would eventually speak with Xi, despite the Chinese leader’s reluctance to engage directly with his counterpart. “It’ll happen,” Trump said.

“China doesn’t need to talk to the US until it takes meaningful measures,” Yuyuantantian said in the post. From a negotiation standpoint, the US is “clearly the more anxious party at the moment,” it added, citing pressure the Trump administration faces on multiple fronts.

In Washington, official data showed the US economy contracted at the start of the year for the first time since 2022 following a monumental pre-tariffs import surge and more moderate consumer spending. The data provided a first snapshot of ripple effects from Trump’s trade policies.

At the same time, prices from some of the most popular sellers of made-in-China goods already suggest US shoppers will be paying a major portion of the bill despite Trump’s claim Beijing will bear the brunt of his 145% tariffs.

Sources:

* No paywall: [https://finance.yahoo.com/news/us-reached-china-initiate-tariff-232004629.html](https://finance.yahoo.com/news/us-reached-china-initiate-tariff-232004629.html)
* Paywall: [https://www.bloomberg.com/news/articles/2025-04-30/us-has-reached-out-to-china-to-initiate-tariff-talks-cctv-says](https://www.bloomberg.com/news/articles/2025-04-30/us-has-reached-out-to-china-to-initiate-tariff-talks-cctv-says)",Reddit,"US Has Reached Out to China to Initiate Tariff Talks, CCTV Says. (Bloomberg) — US President Donald Trump’s administration has been seeking contact with Beijing to initiate talks on the massive tariffs Washington has imposed on China, according to a state-run media outlet.

The US government recently reached out to China though various channels, Yuyuantantian, a Weibo account affiliated with China Central Television that regularly signals Beijing’s views on trade, said in a post. It cited unidentified people with knowledge of the matter, providing no further details.

The post casts a different light on behind-the-scenes maneuvering between the world’s two largest economies. Trump has repeatedly said President Xi Jinping needs to contact him in order to begin tariff talks and earlier this week, Treasury Secretary Scott Bessent said it’s up to Beijing to take the first step to de-escalate the dispute.

Trump argued Wednesday during a Cabinet meeting that a recent fall in cargo flows indicated that Beijing would soon need to engage with him. The president said he was “not happy” with the sharp decline in trade between the two nations because he wanted “China to do well” while treating the US fairly.

Trump later Wednesday expressed confidence he would eventually speak with Xi, despite the Chinese leader’s reluctance to engage directly with his counterpart. “It’ll happen,” Trump said.

“China doesn’t need to talk to the US until it takes meaningful measures,” Yuyuantantian said in the post. From a negotiation standpoint, the US is “clearly the more anxious party at the moment,” it added, citing pressure the Trump administration faces on multiple fronts.

In Washington, official data showed the US economy contracted at the start of the year for the first time since 2022 following a monumental pre-tariffs import surge and more moderate consumer spending. The data provided a first snapshot of ripple effects from Trump’s trade policies.

At the same time, prices from some of the most popular sellers of made-in-China goods already suggest US shoppers will be paying a major portion of the bill despite Trump’s claim Beijing will bear the brunt of his 145% tariffs.

Sources:

* No paywall: [https://finance.yahoo.com/news/us-reached-china-initiate-tariff-232004629.html](https://finance.yahoo.com/news/us-reached-china-initiate-tariff-232004629.html)
* Paywall: [https://www.bloomberg.com/news/articles/2025-04-30/us-has-reached-out-to-china-to-initiate-tariff-talks-cctv-says](https://www.bloomberg.com/news/articles/2025-04-30/us-has-reached-out-to-china-to-initiate-tariff-talks-cctv-says)",0.5233,positive
Tesla Cybertruck inventory skyrockets to record high,https://electrek.co/2025/05/05/tesla-cybertruck-inventory-skyrockets-to-record-high/,2025-05-06 04:02:26,"Tesla’s Cybertruck inventory has skyrocketed to a new record high of more than 10,000 units. The vehicle program is in crisis.

A conservative estimate would be at an average sale price of $78,000, Tesla could have almost $800 million worth of Cybertrucks.

Tesla has been reducing production on the cyber truck, but other headwinds for the Y and 3 also exist.   The current live total is 27676 cars. This is an increase of 15927 from last weeks 11749, an increase of 21388 from last months 6288, and an increase of 9140 from last quarters 18536,",Reddit,"Tesla Cybertruck inventory skyrockets to record high. Tesla’s Cybertruck inventory has skyrocketed to a new record high of more than 10,000 units. The vehicle program is in crisis.

A conservative estimate would be at an average sale price of $78,000, Tesla could have almost $800 million worth of Cybertrucks.

Tesla has been reducing production on the cyber truck, but other headwinds for the Y and 3 also exist.   The current live total is 27676 cars. This is an increase of 15927 from last weeks 11749, an increase of 21388 from last months 6288, and an increase of 9140 from last quarters 18536,",0.7662,positive
"People keep asking for proof that he said this, but since I can't edit a post here once I post it, here's the video in a new post.",https://www.threads.com/@aaron.rupar/post/DJFFRGLpJL1/media,2025-04-30 19:45:37,"Some of this is worse than the quote, because he saying that Chinese factories are all sitting empty because America is their only customer.

While I'm sure that there are some factories like that, the story in the media has changed.  Earlier we were hearing claims that America buys more than half of China's output.

The number I'm seeing now is that exports to the US were 2.9% of their GDP in 2024.  So, yeah, that earlier rumor was bullshit.

And China is a dictatorship, so if their leader wants to do something painful, he can get away with it.

And taking America's place among our allies who Trump has all insulted and betrayed is too good a deal to pass up.  And so stiffing Trump is good international politics, and probably good domestic anyway.

I hear that Trump is popular among a lot of Chinese people because they believe that he's destroying the US.  So at least SOME people like him.

The partial quote I copied last time was 

>They made a trillion dollars with Biden selling us stuff. Much of it we don't need. Somebody said ""oh, the shelves are gonna be open.""  Well maybe the children will have 2 dolls instead of 30 doll, and maybe the two dolls will cost a couple of bucks more.

>

The CEOs of Walmart and Target warned him that they're about to have empty shelves and all they got was Trump mocking them with ""Somebody said 'oh the shelves are gonna be open.""

""Somebody said""

In effect he is willing to rule over a much poorer country in order to never have been wrong.

I don't think he has a choice, *he can’t accept himself being wrong or mistaken the same way a healthy person without narcissism can.* He’ll take any and every whacky explanation available for why he’s not wrong, and on some level I think he believes it.

For maybe 40 years he's been getting audiences angry with his rant that trade imbalances are the same as being cheated out of all of your money.  It's based on a complete misunderstanding, a stupid one.  But as a narcissist, it is emotionally impossible for it not to be true.

",Reddit,"People keep asking for proof that he said this, but since I can't edit a post here once I post it, here's the video in a new post.. Some of this is worse than the quote, because he saying that Chinese factories are all sitting empty because America is their only customer.

While I'm sure that there are some factories like that, the story in the media has changed.  Earlier we were hearing claims that America buys more than half of China's output.

The number I'm seeing now is that exports to the US were 2.9% of their GDP in 2024.  So, yeah, that earlier rumor was bullshit.

And China is a dictatorship, so if their leader wants to do something painful, he can get away with it.

And taking America's place among our allies who Trump has all insulted and betrayed is too good a deal to pass up.  And so stiffing Trump is good international politics, and probably good domestic anyway.

I hear that Trump is popular among a lot of Chinese people because they believe that he's destroying the US.  So at least SOME people like him.

The partial quote I copied last time was 

>They made a trillion dollars with Biden selling us stuff. Much of it we don't need. Somebody said ""oh, the shelves are gonna be open.""  Well maybe the children will have 2 dolls instead of 30 doll, and maybe the two dolls will cost a couple of bucks more.

>

The CEOs of Walmart and Target warned him that they're about to have empty shelves and all they got was Trump mocking them with ""Somebody said 'oh the shelves are gonna be open.""

""Somebody said""

In effect he is willing to rule over a much poorer country in order to never have been wrong.

I don't think he has a choice, *he can’t accept himself being wrong or mistaken the same way a healthy person without narcissism can.* He’ll take any and every whacky explanation available for why he’s not wrong, and on some level I think he believes it.

For maybe 40 years he's been getting audiences angry with his rant that trade imbalances are the same as being cheated out of all of your money.  It's based on a complete misunderstanding, a stupid one.  But as a narcissist, it is emotionally impossible for it not to be true.

",-0.9734,negative
Warren Buffett shocks shareholders by announcing his intention to retire at the end of the year,https://apnews.com/article/warren-buffett-berkshire-hathaway-shareholders-annual-meeting-a421061233f99859673fb131ce020d4d,2025-05-03 18:16:42,,Reddit,Warren Buffett shocks shareholders by announcing his intention to retire at the end of the year. ,-0.3818,negative
The stock market’s worst first 100 days of any presidential term in more than 50 years,https://www.cnn.com/2025/04/29/investing/us-stock-market/index.html,2025-04-30 13:00:49,,Reddit,The stock market’s worst first 100 days of any presidential term in more than 50 years. ,-0.6249,negative
U.S. Chamber of Commerce asks Trump for tariff exclusions to 'stave off a recession',https://www.cnbc.com/amp/2025/05/01/trump-tariffs-recession-chamber-of-commerce.html,2025-05-01 16:48:32,,Reddit,U.S. Chamber of Commerce asks Trump for tariff exclusions to 'stave off a recession'. ,0.0,neutral
