title,url,publishedAt,description,source,text,sentiment_score,sentiment_label
Moving wife's high fee funds,https://www.reddit.com/r/investing/comments/1keq2zs/moving_wifes_high_fee_funds/,2025-05-04 18:00:49,"My wife (almost 56) has a T. Rowe rollover IRA(PRJIX, TRAIX, PRZIX) that my late brother helped her set up starting about 25 years ago. It has done well for her over time, with about an 8.5% average return even with the recent market turmoil. A total of about $95k invested on 2 occasions($30k in 1999, $65k in 2010) has turned into $500k+ with no additional contributions. All growth has been from DRIP and capital gains. I honestly never really knew about fund fees until more recently and realized hers were very high. I also noticed that the funds had peaked at over $600k 4 years ago and this opened my eyes that something had really dragged it down. With the recent market volatility, we have talked about getting away from this aggressive(83/17) and high fee portfolio and moving to a more conservative lower fee position that balances capital preservation and growth. Contributions to it will be sporadic depending on how her business is. We'd like to keep it simple and stay with TRP to avoid any tax implications but are hesitating with the right funds to choose. The lower cost typical Bogle-esque 3 fund options are POMIX, PIEQX, and PBDIX but I wondered about PREIX as part of the allocation instead of POMIX. I'm thinking along the lines of a 50% US/20% Int/30% Bond allocation. In the future, I also thought about a dividend weighted fund such as PRDGX for income, but those fees are higher. For context, we likely might not need to touch this for a long time, if at all because of our financial position. I (59) am retiring in 2 months with $4k/month pension and a little over $1m in my union surety fund. I will be taking SS at 62 at about $2700/month. Thoughts?",Reddit,"Moving wife's high fee funds. My wife (almost 56) has a T. Rowe rollover IRA(PRJIX, TRAIX, PRZIX) that my late brother helped her set up starting about 25 years ago. It has done well for her over time, with about an 8.5% average return even with the recent market turmoil. A total of about $95k invested on 2 occasions($30k in 1999, $65k in 2010) has turned into $500k+ with no additional contributions. All growth has been from DRIP and capital gains. I honestly never really knew about fund fees until more recently and realized hers were very high. I also noticed that the funds had peaked at over $600k 4 years ago and this opened my eyes that something had really dragged it down. With the recent market volatility, we have talked about getting away from this aggressive(83/17) and high fee portfolio and moving to a more conservative lower fee position that balances capital preservation and growth. Contributions to it will be sporadic depending on how her business is. We'd like to keep it simple and stay with TRP to avoid any tax implications but are hesitating with the right funds to choose. The lower cost typical Bogle-esque 3 fund options are POMIX, PIEQX, and PBDIX but I wondered about PREIX as part of the allocation instead of POMIX. I'm thinking along the lines of a 50% US/20% Int/30% Bond allocation. In the future, I also thought about a dividend weighted fund such as PRDGX for income, but those fees are higher. For context, we likely might not need to touch this for a long time, if at all because of our financial position. I (59) am retiring in 2 months with $4k/month pension and a little over $1m in my union surety fund. I will be taking SS at 62 at about $2700/month. Thoughts?",-0.2854,negative
Looking for historic stock prices,https://www.reddit.com/r/investing/comments/1kcb5li/looking_for_historic_stock_prices/,2025-05-01 15:12:35,"I can’t seem to find this website I used this year during tax season that helped me find cost basis. The site let me search up individual stock prices by specific date. I inherited stock more that 15 years ago, and I was easily able to calculate my cost basis using this website. 

Today, when I searched “historical stock prices” I only found websites for pay-for historical databases and stock analysis. I’m curious if anyone knows of a free online lookup of stock prices by date so I can figure out cost basis. 

Thanks so much!",Reddit,"Looking for historic stock prices. I can’t seem to find this website I used this year during tax season that helped me find cost basis. The site let me search up individual stock prices by specific date. I inherited stock more that 15 years ago, and I was easily able to calculate my cost basis using this website. 

Today, when I searched “historical stock prices” I only found websites for pay-for historical databases and stock analysis. I’m curious if anyone knows of a free online lookup of stock prices by date so I can figure out cost basis. 

Thanks so much!",0.8805,positive
Where can I park my cash in my brokerage account to grow/earn interest?,https://www.reddit.com/r/investing/comments/1kc6w6l/where_can_i_park_my_cash_in_my_brokerage_account/,2025-05-01 11:56:46,"I've been holding a lot of cash for the past few months and I think it's wasting away, I've tried to invest in a few ETFs, but I want something that is super duper stable but grows similar to high yield savings account, without having to move my money to my high-yield savings account, because I want to be able to liquidate and be able to buy stocks on these volatile crash days, but generally I'm still holding a bunch of cash..
Thanks!",Reddit,"Where can I park my cash in my brokerage account to grow/earn interest?. I've been holding a lot of cash for the past few months and I think it's wasting away, I've tried to invest in a few ETFs, but I want something that is super duper stable but grows similar to high yield savings account, without having to move my money to my high-yield savings account, because I want to be able to liquidate and be able to buy stocks on these volatile crash days, but generally I'm still holding a bunch of cash..
Thanks!",0.8687,positive
"Best place to invest $200,000 short term.",https://www.reddit.com/r/investing/comments/1kc03er/best_place_to_invest_200000_short_term/,2025-05-01 04:17:43,"Need to be able to access it for house down-payment in the next 6-12 months but would at least like to earn as much risk-free interest as possible. I’m assuming high-yield savings? CD? I’m looking for specific answers. Like, “So and so bank has x”. Thanks!",Reddit,"Best place to invest $200,000 short term.. Need to be able to access it for house down-payment in the next 6-12 months but would at least like to earn as much risk-free interest as possible. I’m assuming high-yield savings? CD? I’m looking for specific answers. Like, “So and so bank has x”. Thanks!",0.9559,positive
What do invest in with settlement funds?,https://www.reddit.com/r/investing/comments/1kbxk1u/what_do_invest_in_with_settlement_funds/,2025-05-01 01:56:37,"Long story short, I won a lawsuit by settling out of court and will be receiving my settlement funds soon. I’ve never been able to maintain savings, let alone done any investing. What would you suggest if this happened to a friend or family member? Any advice is welcome 🙏🏾",Reddit,"What do invest in with settlement funds?. Long story short, I won a lawsuit by settling out of court and will be receiving my settlement funds soon. I’ve never been able to maintain savings, let alone done any investing. What would you suggest if this happened to a friend or family member? Any advice is welcome 🙏🏾",0.8105,positive
Etfs vs invest in house in plan ready in 2028,https://www.reddit.com/r/investing/comments/1kfy7m7/etfs_vs_invest_in_house_in_plan_ready_in_2028/,2025-05-06 06:59:02,"I am 29 years old, have a stable job with 3000k income per month in lisbon. I dont pay rent as i live in my parent's house and start investing in etfs 3 years ago and got 30.000 savings in a diversified portofolio. Something that got my attention are houses in plan as they are must cheaper and seem a good thing to invest for the future, and i would like to have a house of mine to not be dependent of my parents or my girlfriend (who has a house in lisbon already) and one cant predict the future of relationships....This house is 400.000 in lisbon surroundings, 30min from my work (which could be a down point, as now i live 15min from it) in a place that will have a future metro station in 3 years and will have all commodities of modern live (a+, pool, gym...). In 2028 i will have a big increase of salary probably around 5-10k month so the timming is perfect to borrow money from the bank at that time. All they ask is 20k now and at 6,12 and 18 months. My parents can help me at the first and second payments. Should i keep investing in etfs or start investing in plan houses? The constructor is good with lots of buildings made with sucess. Other option is finding something nearby the workplace but everything with that price is more than 20 years old and most without private parking ",Reddit,"Etfs vs invest in house in plan ready in 2028. I am 29 years old, have a stable job with 3000k income per month in lisbon. I dont pay rent as i live in my parent's house and start investing in etfs 3 years ago and got 30.000 savings in a diversified portofolio. Something that got my attention are houses in plan as they are must cheaper and seem a good thing to invest for the future, and i would like to have a house of mine to not be dependent of my parents or my girlfriend (who has a house in lisbon already) and one cant predict the future of relationships....This house is 400.000 in lisbon surroundings, 30min from my work (which could be a down point, as now i live 15min from it) in a place that will have a future metro station in 3 years and will have all commodities of modern live (a+, pool, gym...). In 2028 i will have a big increase of salary probably around 5-10k month so the timming is perfect to borrow money from the bank at that time. All they ask is 20k now and at 6,12 and 18 months. My parents can help me at the first and second payments. Should i keep investing in etfs or start investing in plan houses? The constructor is good with lots of buildings made with sucess. Other option is finding something nearby the workplace but everything with that price is more than 20 years old and most without private parking ",0.8749,positive
Contribute to 403b with no match or stick with ROTH IRA?,https://www.reddit.com/r/investing/comments/1kfuxfq/contribute_to_403b_with_no_match_or_stick_with/,2025-05-06 03:27:01,"Im 28 and recently got a job in a school district making 60k salary that offers a 403b but no match. However, I get a pension from them that takes 5% from my paycheck. The last few years I’ve been maxing out my ROTH IRA. I feel like just having the ROTH and the pension is fine with me but just wanted opinions if it matters to have both. ",Reddit,"Contribute to 403b with no match or stick with ROTH IRA?. Im 28 and recently got a job in a school district making 60k salary that offers a 403b but no match. However, I get a pension from them that takes 5% from my paycheck. The last few years I’ve been maxing out my ROTH IRA. I feel like just having the ROTH and the pension is fine with me but just wanted opinions if it matters to have both. ",0.296,positive
Is my understanding of this scenario correct?,https://www.reddit.com/r/investing/comments/1kfdt3g/is_my_understanding_of_this_scenario_correct/,2025-05-05 15:02:34,"
I am an investment firm. Client A is my preferred client, dedicates a lot of money, contributes more in fees, refers their rich friends. Client B is my typical client, retiree, retail investor, passive and/or lower income. 

Monday morning: 
Client A has a lot to unload, is looking to move capital out of equities and into something less volatile. 

Client B is ready to make their weekly/monthly payroll investment. 

Shares of XYZ are trading at $100. Client A wants to sell 50, client B wants to buy 100. Whose order gets processed first? Client B, which causes the price to rise. Client B pays more as Client A’s shares are withheld. Then once Client B is filled and the market is moved up Client A’s shares are sold. Giving Client A a better price and Client B a worse price. Because Client A is the preferred client. 

I could think of a dozen versions of this scenario. I am assuming this happens all day, every day at an enormous scale right? ",Reddit,"Is my understanding of this scenario correct?. 
I am an investment firm. Client A is my preferred client, dedicates a lot of money, contributes more in fees, refers their rich friends. Client B is my typical client, retiree, retail investor, passive and/or lower income. 

Monday morning: 
Client A has a lot to unload, is looking to move capital out of equities and into something less volatile. 

Client B is ready to make their weekly/monthly payroll investment. 

Shares of XYZ are trading at $100. Client A wants to sell 50, client B wants to buy 100. Whose order gets processed first? Client B, which causes the price to rise. Client B pays more as Client A’s shares are withheld. Then once Client B is filled and the market is moved up Client A’s shares are sold. Giving Client A a better price and Client B a worse price. Because Client A is the preferred client. 

I could think of a dozen versions of this scenario. I am assuming this happens all day, every day at an enormous scale right? ",0.9445,positive
I learned something new today about investment management fees,https://www.reddit.com/r/investing/comments/1kf7jbr/i_learned_something_new_today_about_investment/,2025-05-05 09:40:46,"I have a good portion of my investments professionally managed.  I know that the fees are not tax deductible, which doesn’t seem logical to me, but the law is the law.

What I didn’t realize is that the fees on IRA accounts are essentially tax deductible because they are taken from pretax money, I.e. the account is not subjected to a taxable withdrawal for those fees.

",Reddit,"I learned something new today about investment management fees. I have a good portion of my investments professionally managed.  I know that the fees are not tax deductible, which doesn’t seem logical to me, but the law is the law.

What I didn’t realize is that the fees on IRA accounts are essentially tax deductible because they are taken from pretax money, I.e. the account is not subjected to a taxable withdrawal for those fees.

",0.2732,positive
What are your thoughts on mid-cap investing?,https://www.reddit.com/r/investing/comments/1kewi84/what_are_your_thoughts_on_midcap_investing/,2025-05-04 22:39:58,"TLDR: What are your thoughts on mid-cap investing?

I’ve recently become interested in investing and am trying to set up my 401k. I’ve heard people say to invest in funds that follow the S&P 500, so I’m looking into those. When comparing returns of the various funds offered, I see that some of the funds that have a mix of mid-cap and large-cap funds are relatively equal or slightly outperform the S&P style funds. Specifically I’m looking at MLRRX, VEIRX and VMGMX currently. How many people here invest a percentage of their portfolios in mid-cap? If you do, what’s your percentage? Thanks. ",Reddit,"What are your thoughts on mid-cap investing?. TLDR: What are your thoughts on mid-cap investing?

I’ve recently become interested in investing and am trying to set up my 401k. I’ve heard people say to invest in funds that follow the S&P 500, so I’m looking into those. When comparing returns of the various funds offered, I see that some of the funds that have a mix of mid-cap and large-cap funds are relatively equal or slightly outperform the S&P style funds. Specifically I’m looking at MLRRX, VEIRX and VMGMX currently. How many people here invest a percentage of their portfolios in mid-cap? If you do, what’s your percentage? Thanks. ",0.7622,positive
"Newby question, but how do dividends work in accumulating ETFs?",https://www.reddit.com/r/investing/comments/1ke6lgk/newby_question_but_how_do_dividends_work_in/,2025-05-03 23:51:18,"Newby question, but like, I know in Distributing ETFs you just get some dividend money every quarter deposited into your bank account.

But how does it work with accumulating ETFs? I know it gets reinvested into the ETF itself, but does that mean you just get more shares of said ETF every quarter instead? Or do you get money into the broker",Reddit,"Newby question, but how do dividends work in accumulating ETFs?. Newby question, but like, I know in Distributing ETFs you just get some dividend money every quarter deposited into your bank account.

But how does it work with accumulating ETFs? I know it gets reinvested into the ETF itself, but does that mean you just get more shares of said ETF every quarter instead? Or do you get money into the broker",0.7923,positive
Am I being irrational with my allocation ?,https://www.reddit.com/r/investing/comments/1ke44te/am_i_being_irrational_with_my_allocation/,2025-05-03 21:50:33,"I'm 25 years old and started investing about 4–5 months ago. I have a stable income and live with my parents, which allows me to save and invest around $800–$1,000 per month.

Here's how I currently allocate each deposit:

* **50%** goes into SPY
* **30%** into specific companies I screen and have good rationale on (I work as an equity analyst) 
* **20%** into call options with expiries of one month or longer

I’m fully aware that options trading is risky, and my track record currently is around 50/50. I’ve been criticized for having such a large allocation (20%) in options, with colleagues and friends telling me I should just increase my S&P allocation instead of ""gambling.""

But here’s my thought process: I know I still have a lot to learn, and I believe the best way to understand options is through actual trading. I feel like because I am 25 and have a stable income, I can bear some risk. However, I am still new to this, and I believe there are people in this subreddit that have been in my shoes at some point in their life and have a solid advice on the matter.  

So, my question is:  
Am I being reckless and irrational with this 20% allocation, or is this a reasonable way to gain experience in options trading? ",Reddit,"Am I being irrational with my allocation ?. I'm 25 years old and started investing about 4–5 months ago. I have a stable income and live with my parents, which allows me to save and invest around $800–$1,000 per month.

Here's how I currently allocate each deposit:

* **50%** goes into SPY
* **30%** into specific companies I screen and have good rationale on (I work as an equity analyst) 
* **20%** into call options with expiries of one month or longer

I’m fully aware that options trading is risky, and my track record currently is around 50/50. I’ve been criticized for having such a large allocation (20%) in options, with colleagues and friends telling me I should just increase my S&P allocation instead of ""gambling.""

But here’s my thought process: I know I still have a lot to learn, and I believe the best way to understand options is through actual trading. I feel like because I am 25 and have a stable income, I can bear some risk. However, I am still new to this, and I believe there are people in this subreddit that have been in my shoes at some point in their life and have a solid advice on the matter.  

So, my question is:  
Am I being reckless and irrational with this 20% allocation, or is this a reasonable way to gain experience in options trading? ",0.9332,positive
Putting our home down payment money in VMFXX and SWVXX,https://www.reddit.com/r/investing/comments/1ke3fq8/putting_our_home_down_payment_money_in_vmfxx_and/,2025-05-03 21:18:03,"We close on our home purchase in 2 months so I’m putting the funds in money markets on Schwab and Vanguard. Why am I paranoid the banking system will collapse by June 30th? Is there anyway we could possibly lose 
Money on this? My wife gonna kill me if I lose our dream home money trying to get an extra $1600 in interest hahaha ",Reddit,"Putting our home down payment money in VMFXX and SWVXX. We close on our home purchase in 2 months so I’m putting the funds in money markets on Schwab and Vanguard. Why am I paranoid the banking system will collapse by June 30th? Is there anyway we could possibly lose 
Money on this? My wife gonna kill me if I lose our dream home money trying to get an extra $1600 in interest hahaha ",-0.7941,negative
BRK/B vs SWLGX for growth?,https://www.reddit.com/r/investing/comments/1ke0350/brkb_vs_swlgx_for_growth/,2025-05-03 18:46:08,"I’ve been investing 35% of my brokerage portfolio in SWLGX - about $3,500 a month. I’m considering lowering that to $3,000 per month and putting about $500 per month in BRK/B. 

BRK/B seems to have really good performance and while past results do not indicate future results, I feel like it may be a decent single stock to throw 5% of my brokerage portfolio in. 

Since it’s relevant to the decision, the amounts I currently invest in my brokerage is 35% SWTSX (total stock), 35% SWLGX (large cap growth), 20% SCHD (large cap value/dividend), 5% SWISX (developed intl. markets), and 5% SFENX (emerging intl. markets). 

Like I said I’m considering lowering SWLGX to 30% and using that 5% to buy BRK/B. I can buy fractional shares of it through Schwab. 

So what does everyone think? BRK/B seems a bit too good to be true, so what’s the catch? ",Reddit,"BRK/B vs SWLGX for growth?. I’ve been investing 35% of my brokerage portfolio in SWLGX - about $3,500 a month. I’m considering lowering that to $3,000 per month and putting about $500 per month in BRK/B. 

BRK/B seems to have really good performance and while past results do not indicate future results, I feel like it may be a decent single stock to throw 5% of my brokerage portfolio in. 

Since it’s relevant to the decision, the amounts I currently invest in my brokerage is 35% SWTSX (total stock), 35% SWLGX (large cap growth), 20% SCHD (large cap value/dividend), 5% SWISX (developed intl. markets), and 5% SFENX (emerging intl. markets). 

Like I said I’m considering lowering SWLGX to 30% and using that 5% to buy BRK/B. I can buy fractional shares of it through Schwab. 

So what does everyone think? BRK/B seems a bit too good to be true, so what’s the catch? ",0.9174,positive
