title,url,publishedAt,description,source,text,sentiment_score,sentiment_label
Construction Spending Decreased 0.5% in March,https://www.calculatedriskblog.com/2025/05/construction-spending-decreased-05-in.html,2025-05-01T14:17:00Z,From the Census Bureau reported  that overall construction spending decreased:  Construction spending during March 2025 was estimated at a s...,"{'id': None, 'name': 'Calculatedriskblog.com'}",Construction Spending Decreased 0.5% in March. From the Census Bureau reported  that overall construction spending decreased:  Construction spending during March 2025 was estimated at a s...,0.0,neutral
Want to jump in on the gold rally? 3 tips from a fund manager up 39% in 2025,https://www.businessinsider.com/gold-rally-price-investing-tips-trump-trade-war-recession-inflation-2025-5,2025-05-01T09:30:02Z,The price of gold has skyrocketed in 2025 as investors seek an inflation and recession hedge. Here's how to invest.,"{'id': 'business-insider', 'name': 'Business Insider'}",Want to jump in on the gold rally? 3 tips from a fund manager up 39% in 2025. The price of gold has skyrocketed in 2025 as investors seek an inflation and recession hedge. Here's how to invest.,-0.3612,negative
What To Expect From April’s CPI Inflation Report,https://www.forbes.com/sites/simonmoore/2025/05/05/what-to-expect-from-aprils-cpi-inflation-report/,2025-05-05T09:45:00Z,"April’s Consumer Price Index inflation report, scheduled for release on May 13, should deliver another relatively muted inflation reading according to nowcasts.","{'id': None, 'name': 'Forbes'}","What To Expect From April’s CPI Inflation Report. April’s Consumer Price Index inflation report, scheduled for release on May 13, should deliver another relatively muted inflation reading according to nowcasts.",0.0,neutral
"Most Americans use federal science information on a weekly basis, new poll finds",https://www.npr.org/2025/05/06/nx-s1-5387367/federal-science-opinion-use-poll,2025-05-06T10:00:00Z,"Most Americans frequently use federal science information. But few are concerned that cuts to federal science spending could affect their access to such information, a new poll finds.","{'id': None, 'name': 'NPR'}","Most Americans use federal science information on a weekly basis, new poll finds. Most Americans frequently use federal science information. But few are concerned that cuts to federal science spending could affect their access to such information, a new poll finds.",-0.4215,negative
"I bought my husband a 3D printer for fun. It's changed how we fix things around the house and saved us $1,400 just this year.",https://www.businessinsider.com/we-saved-1400-this-year-3d-printing-spare-broken-parts-2025-5,2025-05-02T10:49:01Z,Inna Tysoe bought her husband a 3D printer for his birthday. She thought it would be a good hobby but it's turned into a magical money saver for them.,"{'id': 'business-insider', 'name': 'Business Insider'}","I bought my husband a 3D printer for fun. It's changed how we fix things around the house and saved us $1,400 just this year.. Inna Tysoe bought her husband a 3D printer for his birthday. She thought it would be a good hobby but it's turned into a magical money saver for them.",0.6124,positive
Xbox Console Price Hikes Cement Game Pass as the Only Way Microsoft Wants You to Play,https://gizmodo.com/xbox-console-price-hikes-cement-game-pass-as-the-only-way-microsoft-wants-you-to-play-2000596907,2025-05-01T15:50:13Z,"An Xbox Series X now starts at $550, and you can expect $80 games to arrive soon enough.","{'id': None, 'name': 'Gizmodo.com'}","Xbox Console Price Hikes Cement Game Pass as the Only Way Microsoft Wants You to Play. An Xbox Series X now starts at $550, and you can expect $80 games to arrive soon enough.",0.34,positive
"Disney, Palantir, AMD and more stocks to watch this week",https://qz.com/disney-palantir-amd-uber-coinbase-earnings-stock-market-1851778787,2025-05-04T09:00:00Z,"After blockbuster earnings last week from Big Tech, capped by Apple (AAPL), Amazon (AMZN), and a weekend of Buffett wisdom at Berkshire Hathaway’s (BRK.A) annual meeting, markets are still digesting what it all means. The Dow, S&P, and Nasdaq are rallying, bu…","{'id': None, 'name': 'Quartz India'}","Disney, Palantir, AMD and more stocks to watch this week. After blockbuster earnings last week from Big Tech, capped by Apple (AAPL), Amazon (AMZN), and a weekend of Buffett wisdom at Berkshire Hathaway’s (BRK.A) annual meeting, markets are still digesting what it all means. The Dow, S&P, and Nasdaq are rallying, bu…",0.8402,positive
Key Inflation Measure Slowed To Multiyear Low In March—But Tariff Bump On The Horizon,https://www.forbes.com/sites/dereksaul/2025/04/30/inflation-slowed-to-multiyear-low-in-march-but-tariff-bump-on-the-horizon/,2025-04-30T14:04:37Z,The Federal Reserve’s favored inflation yardstick has been above its 2% target for 49 consecutive months.,"{'id': None, 'name': 'Forbes'}",Key Inflation Measure Slowed To Multiyear Low In March—But Tariff Bump On The Horizon. The Federal Reserve’s favored inflation yardstick has been above its 2% target for 49 consecutive months.,0.1779,positive
Live Coverage of GDP and PCE Inflation Data,https://biztoc.com/x/3690748a1544593e,2025-04-30T07:19:05Z,Live Coverage of GDP and PCE Inflation Data,"{'id': None, 'name': 'Biztoc.com'}",Live Coverage of GDP and PCE Inflation Data. Live Coverage of GDP and PCE Inflation Data,0.0,neutral
Charts for Trump’s first 100 days,https://flowingdata.com/2025/04/30/charts-for-trumps-first-100-days/,2025-04-30T17:55:36Z,"News outlets tend to highlight the first 100 days of a new administration, and they like to show the changes with charts. It gives a feel for a true direction instead of empty claims and where we m…","{'id': None, 'name': 'Flowingdata.com'}","Charts for Trump’s first 100 days. News outlets tend to highlight the first 100 days of a new administration, and they like to show the changes with charts. It gives a feel for a true direction instead of empty claims and where we m…",0.7096,positive
Tariff Uncertainties – Part 2: The Link To Inflation,https://www.forbes.com/sites/georgecalhoun/2025/04/30/tariff-uncertainties--part-2-the-link-to-inflation/,2025-04-30T18:55:44Z,Many assume tariffs will cause inflation. Economic theory also supports the opposite view – exchange rate shifts may offset price increases. It's a major Known Unknown.,"{'id': None, 'name': 'Forbes'}",Tariff Uncertainties – Part 2: The Link To Inflation. Many assume tariffs will cause inflation. Economic theory also supports the opposite view – exchange rate shifts may offset price increases. It's a major Known Unknown.,0.0258,neutral
Americans are feeling stuck in their jobs — and it's about to get even worse,https://www.businessinsider.com/employees-stuck-job-search-hiring-work-trump-tariffs-2025-5,2025-05-05T08:32:01Z,"Thanks to Trump's tariffs, some of your coworkers may soon be grouchier than ever.","{'id': 'business-insider', 'name': 'Business Insider'}","Americans are feeling stuck in their jobs — and it's about to get even worse. Thanks to Trump's tariffs, some of your coworkers may soon be grouchier than ever.",-0.5719,negative
"For GenZers working in clean energy, DOGE's cuts mean finding creative career pivots",https://www.businessinsider.com/gen-zers-clean-energy-climate-job-cuts-doge-trump-musk-2025-5,2025-05-05T08:17:01Z,"The upheaval in Washington, DC, has clouded Gen Zs career paths, particularly in the renewable energy industry as Trump slashes programs.","{'id': 'business-insider', 'name': 'Business Insider'}","For GenZers working in clean energy, DOGE's cuts mean finding creative career pivots. The upheaval in Washington, DC, has clouded Gen Zs career paths, particularly in the renewable energy industry as Trump slashes programs.",0.6808,positive
Why Private Equity Is Betting On Tokenization,https://www.forbes.com/sites/azeemkhan/2025/05/04/why-private-equity-is-betting-on-tokenization/,2025-05-04T16:42:18Z,"With Donald Trump back in office, inflation proving difficult to contain, and the Federal Reserve holding rates higher for longer, liquidity is harder to manufacture.","{'id': None, 'name': 'Forbes'}","Why Private Equity Is Betting On Tokenization. With Donald Trump back in office, inflation proving difficult to contain, and the Federal Reserve holding rates higher for longer, liquidity is harder to manufacture.",-0.3612,negative
Republican Student Loan Plan’s Inflation Trap: Repayment Assistance Plan May Make Student Loan Bills Soar,https://www.forbes.com/sites/shaharziv/2025/04/30/republican-student-loan-plans-inflation-trap-repayment-assistance-plan-may-make-student-loan-bills-soar/,2025-04-30T12:45:00Z,"The Republican student loan plan’s new option, Repayment Assistance Plan, doesn’t adjust for inflation; student loan payments may soar over 30 years, even without a raise","{'id': None, 'name': 'Forbes'}","Republican Student Loan Plan’s Inflation Trap: Repayment Assistance Plan May Make Student Loan Bills Soar. The Republican student loan plan’s new option, Repayment Assistance Plan, doesn’t adjust for inflation; student loan payments may soar over 30 years, even without a raise",-0.3182,negative
Trump’s First 100 Days Fuels An Economic Debate: Strategy Or Chaos,https://www.forbes.com/sites/richardmcgahey/2025/04/30/trumps-first-100-days-fuels-an-economic-debate-strategy-or-chaos/,2025-04-30T19:32:32Z,"In his first 100 days, Trump claims to have an economic strategy while many economists see chaos and potential inflation and recession.","{'id': None, 'name': 'Forbes'}","Trump’s First 100 Days Fuels An Economic Debate: Strategy Or Chaos. In his first 100 days, Trump claims to have an economic strategy while many economists see chaos and potential inflation and recession.",-0.8807,negative
President Trump delivers strong 8-word message to Fed after jobs shocker,https://biztoc.com/x/01635c044d3692f2,2025-05-02T18:18:50Z,"The Federal Reserve is stuck in a bind this year, and it isn't getting any easier.
The Fed's dual mandate of low inflation and employment is more at odds than usual, and risks of tariffs fueling inflation as job growth slows have left Fed Chairman Jerome Powe…","{'id': None, 'name': 'Biztoc.com'}","President Trump delivers strong 8-word message to Fed after jobs shocker. The Federal Reserve is stuck in a bind this year, and it isn't getting any easier.
The Fed's dual mandate of low inflation and employment is more at odds than usual, and risks of tariffs fueling inflation as job growth slows have left Fed Chairman Jerome Powe…",-0.3031,negative
"ADP Shows Job Gains Stalling. Fed Inflation Gauge, GDP Data On Tap. (Live Coverage)",https://biztoc.com/x/fc8e5503d02d7b97,2025-04-30T12:27:02Z,"The ADP employment report showed hiring on the wane in April. GDP and PCE inflation reports are up next.
The post ADP Shows Job Gains Stalling. Fed Inflation Gauge, GDP Data On Tap. (Live Coverage) appeared first on Investor's Business Daily.","{'id': None, 'name': 'Biztoc.com'}","ADP Shows Job Gains Stalling. Fed Inflation Gauge, GDP Data On Tap. (Live Coverage). The ADP employment report showed hiring on the wane in April. GDP and PCE inflation reports are up next.
The post ADP Shows Job Gains Stalling. Fed Inflation Gauge, GDP Data On Tap. (Live Coverage) appeared first on Investor's Business Daily.",0.296,positive
Ueda: BoJ flags inflation disruption risk from Trump's tariffs,https://biztoc.com/x/8c258d673e199838,2025-05-01T07:50:43Z,"Bank of Japan Governor Kazuo Ueda warned Thursday that the US tariff policy under United States President Donald Trump could disrupt service inflation and hinder price pass-through.
During a press co...","{'id': None, 'name': 'Biztoc.com'}","Ueda: BoJ flags inflation disruption risk from Trump's tariffs. Bank of Japan Governor Kazuo Ueda warned Thursday that the US tariff policy under United States President Donald Trump could disrupt service inflation and hinder price pass-through.
During a press co...",-0.4404,negative
Deceleration in Turkey’s Inflation Slows After Market Selloff,https://biztoc.com/x/f3de41e13fc220c5,2025-05-05T07:29:42Z,,"{'id': None, 'name': 'Biztoc.com'}",Deceleration in Turkey’s Inflation Slows After Market Selloff. ,0.0,neutral
"Inflation Speeds Up, Quarterly Data Show",https://www.barrons.com/livecoverage/inflation-gdp-economy-pce-data,2025-04-30T13:13:04Z,Follow here for live coverage and analysis of the latest economic data. Two major reports are due today: GDP and PCE inflation.,"{'id': None, 'name': ""Barron's""}","Inflation Speeds Up, Quarterly Data Show. Follow here for live coverage and analysis of the latest economic data. Two major reports are due today: GDP and PCE inflation.",0.0,neutral
Why Low-Debt Stocks Are The Way To Go,https://www.forbes.com/sites/johndorfman/2025/05/05/why-low-debt-stocks-are-the-way-to-go/,2025-05-05T13:00:00Z,"Low-debt stocks always have some advantages. Those are heightened now, when the risks of inflation or recession appear to be elevated. Here are five low-debt stocks to consider.","{'id': None, 'name': 'Forbes'}","Why Low-Debt Stocks Are The Way To Go. Low-debt stocks always have some advantages. Those are heightened now, when the risks of inflation or recession appear to be elevated. Here are five low-debt stocks to consider.",-0.34,negative
"I went to Trump's first 100 days rally. The key issue for rallygoers was, surprisingly, not the economy.",https://www.businessinsider.com/i-went-to-trumps-first-100-days-rally-in-michigan-2025-4,2025-04-30T17:36:17Z,For Trump's most faithful in Michigan — immigration is the key issue.,"{'id': 'business-insider', 'name': 'Business Insider'}","I went to Trump's first 100 days rally. The key issue for rallygoers was, surprisingly, not the economy.. For Trump's most faithful in Michigan — immigration is the key issue.",0.659,positive
What CEOs are saying about how tariffs will impact their businesses — and your wallet,https://www.businessinsider.com/what-ceos-are-saying-about-tariffs-consumer-price-increases-2025-4,2025-04-30T16:33:23Z,CEOs have been grilled on tariffs and their impact on business and consumers' wallets in recent earnings calls and interviews. Here's their answers.,"{'id': 'business-insider', 'name': 'Business Insider'}",What CEOs are saying about how tariffs will impact their businesses — and your wallet. CEOs have been grilled on tariffs and their impact on business and consumers' wallets in recent earnings calls and interviews. Here's their answers.,0.0,neutral
7 charts show falling shipments and weakening confidence — an ominous sign for American shoppers,https://www.businessinsider.com/ominous-charts-show-warning-signs-for-american-shoppers-2025-4,2025-05-01T09:47:01Z,Any single one of these key consumer economy indicators would be noteworthy — all of them together is raising alarms.,"{'id': 'business-insider', 'name': 'Business Insider'}",7 charts show falling shipments and weakening confidence — an ominous sign for American shoppers. Any single one of these key consumer economy indicators would be noteworthy — all of them together is raising alarms.,-0.4767,negative
SPHEREx Space Observatory Begins Mapping the Entire Sky in 102 Wavelengths of Light,https://petapixel.com/2025/05/02/spherex-space-observatory-begins-mapping-the-entire-sky-in-102-wavelengths-of-light/,2025-05-02T17:59:34Z,"NASA's SPHEREx space observatory launched into space in early March and began its scientific operations yesterday, May 1 following weeks of preparation. It is now ready to survey the entire sky with 3,600 daily photos at a time.
[Read More]","{'id': None, 'name': 'PetaPixel'}","SPHEREx Space Observatory Begins Mapping the Entire Sky in 102 Wavelengths of Light. NASA's SPHEREx space observatory launched into space in early March and began its scientific operations yesterday, May 1 following weeks of preparation. It is now ready to survey the entire sky with 3,600 daily photos at a time.
[Read More]",0.4588,positive
Some 9/11 first responders are being turned away from the program meant to save them,https://abcnews.go.com/US/critically-ill-911-responders-turned-program-meant-save/story?id=121338021,2025-05-01T18:41:37Z,"The World Trade Center Health Program can no longer certify illnesses, enroll new members or approve life-saving treatments like chemotherapy or lung transplants.","{'id': 'abc-news', 'name': 'ABC News'}","Some 9/11 first responders are being turned away from the program meant to save them. The World Trade Center Health Program can no longer certify illnesses, enroll new members or approve life-saving treatments like chemotherapy or lung transplants.",0.0772,positive
Shrinking GDP and elevated inflation put Fed in tough spot,https://consent.yahoo.com/v2/collectConsent?sessionId=1_cc-session_8b30b2a6-85b6-4d26-8f8c-84364a034628,2025-04-30T14:22:11Z,,"{'id': None, 'name': 'Yahoo Entertainment'}",Shrinking GDP and elevated inflation put Fed in tough spot. ,-0.128,negative
The 5 biggest challenges facing employers in 2025,https://qz.com/biggest-challenges-facing-employers-2025-korn-ferry-1851777326,2025-05-02T09:00:00Z,Work is changing more rapidly than anyone might have predicted thanks to a slew of pandemic-era disruptions and the threat of AI.Read more...,"{'id': None, 'name': 'Quartz India'}",The 5 biggest challenges facing employers in 2025. Work is changing more rapidly than anyone might have predicted thanks to a slew of pandemic-era disruptions and the threat of AI.Read more...,-0.3818,negative
The End of the ‘Generic’ Grocery-Store Brand,https://www.theatlantic.com/culture/archive/2025/04/grocery-store-generic-brand/682644/,2025-04-30T13:30:00Z,"They’re no longer terrible—in fact, they’re often the draw.","{'id': None, 'name': 'The Atlantic'}","The End of the ‘Generic’ Grocery-Store Brand. They’re no longer terrible—in fact, they’re often the draw.",-0.296,negative
"Philippine annual inflation slows to 1.4% in April, lowest in more than 5 years",https://biztoc.com/x/da40e71ef0d6d279,2025-05-06T01:32:42Z,,"{'id': None, 'name': 'Biztoc.com'}","Philippine annual inflation slows to 1.4% in April, lowest in more than 5 years. ",-0.3818,negative
The 5 Biggest Financial Worries for Retirees in 2025 and How You Can Address Them,https://finance.yahoo.com/news/5-biggest-financial-worries-retirees-110107693.html,2025-05-03T11:01:07Z,"Retirees in 2025 are facing rising medical costs, inflation and market risk. Here are some of the ways to address these concerns and more.","{'id': None, 'name': 'Yahoo Entertainment'}","The 5 Biggest Financial Worries for Retirees in 2025 and How You Can Address Them. Retirees in 2025 are facing rising medical costs, inflation and market risk. Here are some of the ways to address these concerns and more.",-0.5994,negative
"US stock futures tepid ahead of data storm, megacap earnings",https://finance.yahoo.com/news/us-stock-futures-tepid-ahead-101148935.html,2025-04-30T10:11:48Z,"First-quarter gross domestic product data, March's reading of the PCE price index - the Federal Reserve's preferred inflation metric - and ADP employment...","{'id': None, 'name': 'Yahoo Entertainment'}","US stock futures tepid ahead of data storm, megacap earnings. First-quarter gross domestic product data, March's reading of the PCE price index - the Federal Reserve's preferred inflation metric - and ADP employment...",-0.4767,negative
A New Sign That AI Is Competing With College Grads,https://www.theatlantic.com/economy/archive/2025/04/job-market-youth/682641/,2025-04-30T10:00:00Z,Higher ed doesn’t confer the same labor advantages that it did 15 years ago.,"{'id': None, 'name': 'The Atlantic'}",A New Sign That AI Is Competing With College Grads. Higher ed doesn’t confer the same labor advantages that it did 15 years ago.,0.3612,positive
Walmart makes drastic decision amid tariff threats,https://biztoc.com/x/6b9f1f99156dd68a,2025-05-05T10:47:40Z,"For the past few years, consumers have faced an uphill battle with inflation.
Higher prices started to take hold in 2021, and the problem really hasn't gone away since. Only now, consumers have a new economic issue to deal with — tariffs.
 Don't miss the move…","{'id': None, 'name': 'Biztoc.com'}","Walmart makes drastic decision amid tariff threats. For the past few years, consumers have faced an uphill battle with inflation.
Higher prices started to take hold in 2021, and the problem really hasn't gone away since. Only now, consumers have a new economic issue to deal with — tariffs.
 Don't miss the move…",-0.7688,negative
Treasury yields are steady even as weak jobless claims raise stakes for Friday's jobs report,https://biztoc.com/x/23cf7ddf7bf1856e,2025-05-01T14:47:16Z,"Treasury yields held steady Thursday following reports that the U.S. economy fell into contraction in the first quarter and inflation readings were flat in March.
The benchmark 10-year Treasury note yield rose more than 2 basis points to yield 4.196%. The pol…","{'id': None, 'name': 'Biztoc.com'}","Treasury yields are steady even as weak jobless claims raise stakes for Friday's jobs report. Treasury yields held steady Thursday following reports that the U.S. economy fell into contraction in the first quarter and inflation readings were flat in March.
The benchmark 10-year Treasury note yield rose more than 2 basis points to yield 4.196%. The pol…",0.128,positive
25 Years Of Higher Interest Rates Ahead?,https://biztoc.com/x/9fb4b5eb46c59e42,2025-05-05T15:46:19Z,"25 Years Of Higher Interest Rates Ahead?
 
Authored by Charles Hugh Smith via OfTwoMinds blog,
Interest rates are linked to inflation, but they're also linked to risk.
As a result of recency bias, where we assume the recent past is a permanent state of affair…","{'id': None, 'name': 'Biztoc.com'}","25 Years Of Higher Interest Rates Ahead?. 25 Years Of Higher Interest Rates Ahead?
 
Authored by Charles Hugh Smith via OfTwoMinds blog,
Interest rates are linked to inflation, but they're also linked to risk.
As a result of recency bias, where we assume the recent past is a permanent state of affair…",0.2755,positive
Trump-Amazon spat: What happened and how much US consumers import online,https://www.aljazeera.com/news/2025/4/30/trump-amazon-spat-what-happened-and-how-much-us-consumers-import-online,2025-04-30T14:48:18Z,The White House criticised Amazon after a report said it planned to inform customers how much tariffs will cost them.,"{'id': 'al-jazeera-english', 'name': 'Al Jazeera English'}",Trump-Amazon spat: What happened and how much US consumers import online. The White House criticised Amazon after a report said it planned to inform customers how much tariffs will cost them.,-0.2732,negative
What to expect from the April jobs report,https://qz.com/april-2025-jobs-report-unemployment-tariffs-inflation-1851778682,2025-05-02T09:00:00Z,The already fragile U.S. economy will come under further focus Friday morning with the release of the April jobs report. It will offer a snapshot of economic momentum as signs of strain grow across both public and private sectors — and it’ll provide a look in…,"{'id': None, 'name': 'Quartz India'}",What to expect from the April jobs report. The already fragile U.S. economy will come under further focus Friday morning with the release of the April jobs report. It will offer a snapshot of economic momentum as signs of strain grow across both public and private sectors — and it’ll provide a look in…,-0.0516,negative
Stocks slides as Warren Buffett bows out,https://qz.com/brk-b-pltr-f-1851779089,2025-05-05T12:33:18Z,Stock futures sank Monday morning as investors digested the twin shocks of Warren Buffett’s retirement announcement and the cautious tone in Berkshire Hathaway’s (BRK.A) latest results.Read more...,"{'id': None, 'name': 'Quartz India'}",Stocks slides as Warren Buffett bows out. Stock futures sank Monday morning as investors digested the twin shocks of Warren Buffett’s retirement announcement and the cautious tone in Berkshire Hathaway’s (BRK.A) latest results.Read more...,-0.4588,negative
TTArtisan 35mm T2.1 Cine Lens: Stunning Dual Bokeh for $380,https://www.diyphotography.net/ttartisan-35mm-t2-1-cine-lens-stunning-dual-bokeh-for-380/,2025-05-02T09:53:27Z,"TTArtisan has launched the new 35mm T2.1 Cine Lens. It delivers crisp images with pleasing bokeh, which is primary need of every cinematographer and creative...
The post TTArtisan 35mm T2.1 Cine Lens: Stunning Dual Bokeh for $380 appeared first on DIY Photogr…","{'id': None, 'name': 'DIYphotography'}","TTArtisan 35mm T2.1 Cine Lens: Stunning Dual Bokeh for $380. TTArtisan has launched the new 35mm T2.1 Cine Lens. It delivers crisp images with pleasing bokeh, which is primary need of every cinematographer and creative...
The post TTArtisan 35mm T2.1 Cine Lens: Stunning Dual Bokeh for $380 appeared first on DIY Photogr…",0.8442,positive
Inflation gauge favored by Fed showed price growth slowed in March,https://consent.yahoo.com/v2/collectConsent?sessionId=1_cc-session_4cd2c97e-ee7d-4f4c-b74f-6aba877908a7,2025-04-30T14:04:16Z,,"{'id': None, 'name': 'Yahoo Entertainment'}",Inflation gauge favored by Fed showed price growth slowed in March. ,0.6597,positive
A top business group asks Trump for tariff changes to 'stave off a recession',https://qz.com/chamber-of-commerce-trump-tariffs-recession-1851778624,2025-05-01T14:28:00Z,The U.S. Chamber of Commerce is warning the Trump administration that the trade war could tip the country into a recession. Read more...,"{'id': None, 'name': 'Quartz India'}",A top business group asks Trump for tariff changes to 'stave off a recession'. The U.S. Chamber of Commerce is warning the Trump administration that the trade war could tip the country into a recession. Read more...,-0.8074,negative
